青梅恋语酒店(武汉理工大学店),街道口/武汉大学/南湖,洪山区,工大路理公馆1、2号楼商业3层商(1),http://www.zhuna.cn/hotel-1146024.html,275
7天连锁酒店(武汉虎泉街杨家湾地铁站店),光谷广场/武昌高校区/光谷未来科技城,洪山区,雄楚大道489号领秀城7栋,http://www.zhuna.cn/hotel-35345.html,235
城市便捷酒店(湖北工业大学板桥地铁站店),街道口/武汉大学/南湖,洪山区,湖北工业大学板桥新村商业风情街,http://www.zhuna.cn/hotel-1063012.html,267
38.6℃酒店(武汉楚河汉街店),楚河汉街/东湖风景区,武昌区,松竹路28号万达环球国际中心2号楼一楼大厅,http://www.zhuna.cn/hotel-517133.html,318
雅乐轩酒店(武汉天河机场店),天河机场/盘龙城/奥特莱斯,黄陂区,天河街天河道103号,http://www.zhuna.cn/hotel-1269237.html,162
精途酒店(武汉瑞安街地铁站店),街道口/武汉大学/南湖,武昌区,江宏新村小区附一号(小区2号门),http://www.zhuna.cn/hotel-1324970.html,214
7天连锁酒店(武汉友谊路轻轨站店),江汉路/汉口江滩,江汉区,前进一路燕马新村7号,http://www.zhuna.cn/hotel-32083.html,127
城市便捷酒店(武汉江汉路佳丽广场店),江汉路/汉口江滩,江汉区,前进五路4号,http://www.zhuna.cn/hotel-432535.html,217
城市便捷酒店(武汉街道口店),街道口/武汉大学/南湖,洪山区,武珞路668号,http://www.zhuna.cn/hotel-221419.html,193
城市便捷酒店(武汉汉阳东风公司地铁站店),沌口经济开发区/武汉国际博览中心/汉南,蔡甸区,沌口博学路28号,http://www.zhuna.cn/hotel-423545.html,266
如家酒店(武汉光谷高新大道店),光谷广场/武昌高校区/光谷未来科技城,洪山区,高新大道116号蓝晶国际,http://www.zhuna.cn/hotel-247861.html,189
城市便捷酒店(武汉国际广场协和医院店),汉口金融中心/武汉广场/中山公园,江汉区,武展东路374号,http://www.zhuna.cn/hotel-539147.html,205
如家酒店(武汉光谷青年汇传媒学院店),江夏大学城/藏龙岛/梁子湖,江夏区,藏龙岛光谷大道凤凰台紫微星广场四楼,http://www.zhuna.cn/hotel-209207.html,275
精途酒店(武汉江汉路步行街店),江汉路/汉口江滩,江汉区,江汉二路特2号,http://www.zhuna.cn/hotel-432579.html,191
IU酒店(武汉光谷民族大道武昌理工学院店),江夏大学城/藏龙岛/梁子湖,洪山区,民族大道338号光谷麦郡正门口,http://www.zhuna.cn/hotel-697673.html,218
城市便捷酒店(武汉广埠屯地铁站店),街道口/武汉大学/南湖,洪山区,珞喻路201号附1号(地铁2号线广埠屯地铁站H出口),http://www.zhuna.cn/hotel-434476.html,225
如家酒店(武汉唐家墩地铁站万达广场店),汉口火车站/园博园,江汉区,香港路398号,http://www.zhuna.cn/hotel-190469.html,151
7天优品酒店(武汉蔡甸广场店),沌口经济开发区/武汉国际博览中心/汉南,蔡甸区,蔡甸大街238号,http://www.zhuna.cn/hotel-437144.html,147
精途酒店(武汉园博园店),汉西/宗关/凯德广场,硚口区,华生城市广场南区(长风路与丰美路交叉口),http://www.zhuna.cn/hotel-513731.html,208
汉庭酒店(武汉华中科技大学店),光谷广场/武昌高校区/光谷未来科技城,洪山区,佳园路2号高科大厦一楼,http://www.zhuna.cn/hotel-511415.html,243
