佛山希尔顿酒店,石湾/张槎/南庄,禅城区,岭南大道北127号,http://www.zhuna.cn/hotel-168948.html,647
佛山岭南天地马哥孛罗酒店,祖庙商圈,禅城区,人民路97号,http://www.zhuna.cn/hotel-43456.html,586
佛山顺德喜来登酒店,顺德中心区(大良/容桂),顺德区,大良新城区德胜中路11号,http://www.zhuna.cn/hotel-18455.html,663
佛山罗浮宫索菲特酒店,顺德乐从/龙江区域,顺德区,乐从河滨南路3号,http://www.zhuna.cn/hotel-507337.html,849
佛山顺德美的万豪酒店,顺德中心区(大良/容桂),顺德区,大良南国东路388号美的广场,http://www.zhuna.cn/hotel-328587.html,841
佛山顺德美的臻品之选酒店,顺德周边(陈村/北滘),顺德区,北滘镇君岭路6号B座,http://www.zhuna.cn/hotel-1331583.html,1111
佛山顺德顺联温德姆酒店,顺德周边(陈村/北滘),顺德区,陈村镇佛陈路1号,http://www.zhuna.cn/hotel-49297.html,574
佛山南海瞻云酒店,千灯湖/桂城,南海区,海八东路2号,http://www.zhuna.cn/hotel-965222.html,466
佛山南海和华希尔顿逸林酒店,黄岐/大沥,南海区,大沥镇广佛路盐步段和华商贸广场1座,http://www.zhuna.cn/hotel-1677974.html,661
佛山凤悦酒店,狮山/里水及南海周边,南海区,里广路2号金沙洲广百广场10号楼,http://www.zhuna.cn/hotel-962777.html,488
佛山南海保利皇冠假日酒店,千灯湖/桂城,南海区,环岛南路20号,http://www.zhuna.cn/hotel-1577289.html,573
佛山新城保利洲际酒店,顺德区,顺德区,乐从镇东平新城文华南路8号,http://www.zhuna.cn/hotel-1683448.html,830
佛山保利洲际酒店,千灯湖/桂城,南海区,灯湖东路20号,http://www.zhuna.cn/hotel-18457.html,783
佛山南海假日酒店,狮山/里水及南海周边,南海区,桂丹路乐安路段,http://www.zhuna.cn/hotel-148488.html,350
佛山皇冠假日酒店,祖庙商圈,禅城区,汾江中路118号,http://www.zhuna.cn/hotel-13440.html,492
佛山新君悦国际酒店,顺德周边(陈村/北滘),顺德区,佛陈路东延线1号,http://www.zhuna.cn/hotel-520622.html,695
佛山顺德铂尔曼酒店,顺德周边(陈村/北滘),顺德区,北滘镇林上路2号,http://www.zhuna.cn/hotel-21270.html,585
佛山德徕酒店,岭南明珠体育馆,禅城区,绿景三路4号,http://www.zhuna.cn/hotel-1007513.html,562
佛山富林朗悦酒店,狮山/里水及南海周边,南海区,罗村南湖二路2号,http://www.zhuna.cn/hotel-165378.html,331
佛山南海名都大酒店,黄岐/大沥,南海区,大沥盐步广佛路平地路段南段68号,http://www.zhuna.cn/hotel-10161.html,269
