麗枫酒店(乌鲁木齐高铁万达广场店),乌鲁木齐高铁站地区,沙依巴克区,玄武湖路999号万达广场17号,http://www.zhuna.cn/hotel-827529.html,266
星程酒店(乌鲁木齐机场店),乌鲁木齐经济技术开发区,新市区,乌昌路252号九方财富广场B座,http://www.zhuna.cn/hotel-956162.html,176
麗枫酒店(乌鲁木齐大西门中山路店),碾子沟长途汽车站,天山区,中山路5号,http://www.zhuna.cn/hotel-1363012.html,257
乌鲁木齐蜗酒店,铁路局商圈,新市区,北京南路高新街238号,http://www.zhuna.cn/hotel-538363.html,137
星程酒店(乌鲁木齐会展中心店),友好路商业区,水磨沟区,南湖北路518号南湖明珠一期1栋办公商业楼,http://www.zhuna.cn/hotel-1068449.html,322
全季酒店(乌鲁木齐机场店),地窝堡国际机场,新市区,中亚北路418号,http://www.zhuna.cn/hotel-1006856.html,264
希岸酒店(乌鲁木齐铁路局美居店),铁路局商圈,新市区,河南东路414号,http://www.zhuna.cn/hotel-1667635.html,311
素柏·云酒店(乌鲁木齐长江路德汇万达店),碾子沟长途汽车站,沙依巴克区,伊宁路318号,http://www.zhuna.cn/hotel-193479.html,170
全季酒店(乌鲁木齐中山路店),中山路商业区,天山区,文化路28号,http://www.zhuna.cn/hotel-413762.html,283
麗枫酒店(乌鲁木齐国际机场德港万达店),乌鲁木齐经济技术开发区,新市区,乌昌路56号,http://www.zhuna.cn/hotel-939805.html,221
全季酒店(乌鲁木齐红山店),碾子沟长途汽车站,天山区,新华北路129号,http://www.zhuna.cn/hotel-145399.html,293
全季酒店(乌鲁木齐友好明园店),友好路商业区,沙依巴克区,西北路600号,http://www.zhuna.cn/hotel-1023720.html,313
格林东方酒店(乌鲁木齐人民路店),碾子沟长途汽车站,天山区,人民路226号,http://www.zhuna.cn/hotel-1749244.html,233
宜尚酒店(乌鲁木齐国际机场新天润店),地窝堡国际机场,新市区,北京北路2888号丝路寰球港二期3号,http://www.zhuna.cn/hotel-1611825.html,284
全季酒店(乌鲁木齐新北园春店),沙依巴克区,沙依巴克区,平川路33号,http://www.zhuna.cn/hotel-1259863.html,303
全季酒店(乌鲁木齐北京北路店),地窝堡国际机场,新市区,北京北路52号,http://www.zhuna.cn/hotel-1095122.html,283
希岸酒店(乌鲁木齐机场德港万达店),乌鲁木齐经济技术开发区,新市区,中亚南路111号,http://www.zhuna.cn/hotel-1649834.html,299
如家商旅酒店(乌鲁木齐北京南路小西沟地铁站美克大厦店),铁路局商圈,新市区,北京南路506号美克大厦B座,http://www.zhuna.cn/hotel-1704637.html,195
康铂酒店(乌鲁木齐天津南路店),铁路局商圈,新市区,天津南路206号,http://www.zhuna.cn/hotel-41421.html,180
星程酒店(乌鲁木齐南湖广场店),华凌国际贸易城,水磨沟区,西虹东路751号,http://www.zhuna.cn/hotel-1612567.html,202
