云颐自在酒店(呼和浩特国际会展中心店),新城区中心,赛罕区,丁香南路与巨海城南路交叉口(城发大厦),http://www.zhuna.cn/hotel-1386785.html,421
呼和浩特火车站将军衙署地铁站亚朵轻居酒店,新城区中心,新城区,新华大街155号将军衙署西100米,http://www.zhuna.cn/hotel-1325150.html,355
呼和浩特假日酒店,新城区中心,回民区,中山西路33号,http://www.zhuna.cn/hotel-13140.html,375
呼和浩特锡林郭勒南路亚朵酒店,新城区中心,玉泉区,五塔寺东街内蒙勘察设计院东侧天筑雅园项目1号商业楼1-6层,http://www.zhuna.cn/hotel-1353803.html,315
呼和浩特瑞莱克斯大酒店,长乐宫/万达广场/摩尔城,赛罕区,乌兰察布西街财富时代B座翱华大厦,http://www.zhuna.cn/hotel-1618040.html,381
呼和浩特漳禾酒店,新城区中心,新城区,中山东路9号福瑞药业大厦,http://www.zhuna.cn/hotel-1354433.html,276
云颐自在酒店(呼和浩特气象局军区店),新城区中心,新城区,海拉尔大街八一市场南门西侧,http://www.zhuna.cn/hotel-467452.html,400
呼和浩特鼓楼满都海亚朵酒店,满都海公园/内蒙古医院,新城区,乌兰察布西街45号,http://www.zhuna.cn/hotel-514849.html,362
呼和浩特发展大厦酒店,新城区中心,赛罕区,敕勒川大街发展大厦A座,http://www.zhuna.cn/hotel-1468673.html,430
呼和浩特青城莲花酒店,新城区中心,新城区,东二环路15号,http://www.zhuna.cn/hotel-1751060.html,376
呼和浩特荣氏国际酒店,新城区中心,赛罕区,南二环5号,http://www.zhuna.cn/hotel-488685.html,369
呼和浩特宾悦大酒店,新城区中心,赛罕区,昭乌达路52号,http://www.zhuna.cn/hotel-13915.html,321
呼和浩特福蒙佳酒店,新城区中心,赛罕区,昭乌达路40号,http://www.zhuna.cn/hotel-29162.html,187
呼和浩特高仕第酒店,新城区中心,赛罕区,新建东街巨海城十区4号楼,http://www.zhuna.cn/hotel-442217.html,487
香巴拉酒店(呼和浩特会展中心店),新城区中心,赛罕区,如意南路内蒙古国际会展中心东侧讨号板十二层商业楼,http://www.zhuna.cn/hotel-1617201.html,364
尚华精品酒店(呼和浩特乌兰察布路店),满都海公园/内蒙古医院,新城区,乌兰察布西街33号,http://www.zhuna.cn/hotel-23057.html,232
呼和浩特维力斯大酒店,长乐宫/万达广场/摩尔城,新城区,新华东街89号,http://www.zhuna.cn/hotel-15311.html,303
内蒙古职工之家饭店,新城区中心,赛罕区,滨河路8号,http://www.zhuna.cn/hotel-31870.html,343
内蒙古兴泰名都酒店,新城区中心,新城区,成吉思汗大街2号,http://www.zhuna.cn/hotel-39175.html,313
呼和浩特海德酒店,新城区中心,赛罕区,昭乌达路70号,http://www.zhuna.cn/hotel-15318.html,287
