艾扉酒店(呼和浩特锡林南路金宇店),新城区中心,玉泉区,锡林南路金熙家园南区4号楼雅廷,http://www.zhuna.cn/hotel-1373971.html,214
麗枫酒店(呼和浩特南二环恒大华府店),新城区中心,赛罕区,南二环银河北街恒大华府对面万豪美墅城(蒙中医院对面),http://www.zhuna.cn/hotel-944013.html,309
全季酒店(呼和浩特市政府店),新城区中心,新城区,海拉尔东路与腾飞北路交叉口西南200米兴泰东河湾南商业B座901号,http://www.zhuna.cn/hotel-1076691.html,361
怡莱酒店(内蒙古医科大学附属医院店),呼和浩特站/新华广场,新城区,光明大街43号,http://www.zhuna.cn/hotel-188625.html,105
全季酒店(呼和浩特鼓楼店),鼓楼/内蒙古艺术学院,新城区,新华大街47号,http://www.zhuna.cn/hotel-528262.html,308
如家商旅酒店(呼和浩特工业大学店),新城区中心,新城区,哲里木路47号内蒙古工业大学西门往南斜对面,http://www.zhuna.cn/hotel-232610.html,199
锦颐优选酒店(呼和浩特丁香路万达店),长乐宫/万达广场/摩尔城,新城区,新华东街丁香路10号(万达广场北侧),http://www.zhuna.cn/hotel-29161.html,398
锦颐优选酒店(呼和浩特内蒙古国际会展中心店),新城区中心,赛罕区,如意开发区如意南路国际会展中心东侧,http://www.zhuna.cn/hotel-848862.html,450
如家精选酒店(呼和浩特兴安北路工业大学东门店),新城区中心,新城区,兴安北路甲66天鹅大厦,http://www.zhuna.cn/hotel-538913.html,245
如家商旅酒店(呼和浩特市妇幼院五里营地铁站店),新城区中心,赛罕区,包头大街小城大爱B座,http://www.zhuna.cn/hotel-1705699.html,186
全季酒店(呼和浩特会展中心店),新城区中心,赛罕区,腾飞南路亿利敖东国际花园小区北侧亿利敖东商务楼,http://www.zhuna.cn/hotel-1074839.html,343
H酒店(呼和浩特鼓楼将军衙署地铁站店),鼓楼/内蒙古艺术学院,新城区,鼓楼立交桥新城南街2号房地产大厦,http://www.zhuna.cn/hotel-463571.html,186
如家精选酒店(呼和浩特丰州路店),新城区中心,赛罕区,鹏欣金游城S1号楼,http://www.zhuna.cn/hotel-489964.html,270
喆·啡酒店(呼和浩特东站市政府店),新城区中心,新城区,腾飞路兴泰东河湾N-GJ-6,http://www.zhuna.cn/hotel-1708636.html,358
如家精选酒店(呼和浩特锡林南路闻都广场店),新城区中心,玉泉区,南二环高架桥与锡林南路西南角闻都城市广场18号B座25层2501号,http://www.zhuna.cn/hotel-1188257.html,270
如家商旅酒店(呼和浩特鼓楼将军衙署地铁站店),新城区中心,新城区,新华大街33号,http://www.zhuna.cn/hotel-1001162.html,203
宜必思酒店(呼和浩特摩尔城店),长乐宫/万达广场/摩尔城,赛罕区,东影南路58号,http://www.zhuna.cn/hotel-179679.html,149
如家精选酒店(呼和浩特中山西路店),呼和浩特站/新华广场,回民区,公园东路24号,http://www.zhuna.cn/hotel-483087.html,256
蒲公英智爱酒店(呼和浩特万达广场店),长乐宫/万达广场/摩尔城,赛罕区,新华东街万达广场五星板式公寓5层,http://www.zhuna.cn/hotel-1285116.html,310
